{"schemaVersion":"1.0","assetId":"forzy-motor-01","selectedAt":"2026-08-22T12:00:00.000Z","segmentId":null,"anchor":null,"channels":{"s1":null,"s2":null},"assessment":null,"decisionFacts":{"schemaVersion":"1.0","conditionState":"unknown","conditionTemporalScope":"none","conditionAsOf":null,"conditionEpisodeStartedAt":null,"conditionSource":"none","collectionState":"historical_gap","collectionExpectation":"not_applicable","dataAvailability":"gap","dataFreshness":"historical","dataTrust":"insufficient"},"provenance":{"pointSourceKind":null,"pointSourceSystem":null,"activeHistoricalBatchId":"sha256:aaaaaaaaaaaaaaaaaaaaaaaaaaaaaaaaaaaaaaaaaaaaaaaaaaaaaaaaaaaaaaaa","collectionPolicyId":null,"assessmentSource":"none"},"capabilities":{"historicalNavigation":true,"pairedChannels":false,"causalAssessment":false,"baselineComparison":false,"previousCycleComparison":false},"limitations":[]}
